area,subarea,nome_revista,estrato_qualis,escopo,link_site,link_template
Enfermagem,saúde pública,Revista Brasileira de Enfermagem,A1,"Enfermagem, saúde coletiva, políticas de saúde","https://www.abeneventos.com.br/reben","https://www.abeneventos.com.br/reben/normas"
Enfermagem,clínica,Texto & Contexto Enfermagem,A2,"Enfermagem clínica, cuidado hospitalar","https://www.textoecontexto.ufsc.br","https://www.textoecontexto.ufsc.br/normas"
Engenharia Civil,saneamento,Revista DAE,A2,"Saneamento básico, recursos hídricos","https://revistadae.com.br","https://revistadae.com.br/normas"
Engenharia Civil,geral,Revista IBRACON de Estruturas,A2,"Estruturas, concreto, materiais de construção","https://www.ibracon.org.br/publicacoes/revista","https://www.ibracon.org.br/publicacoes/revista/normas"
Administração,gestão,Revista de Administração Contemporânea,A2,"Administração, gestão, organizações","https://rac.anpad.org.br","https://rac.anpad.org.br/normas"

